index,Chapter,Neg,Pos,line,Positive
1156,chapter_15,0.4638329606416388,0.5361670393583612,"Pierre saw that Boris wished to change the subject, and being of the same mind he began explaining the advantages and disadvantages of the Boulogne expedition.",True
1155,chapter_15,0.5476581354871516,0.4523418645128484,"""And so you think Napoleon will manage to get an army across?"" asked Boris with a smile.",False
1154,chapter_15,0.1859653655119875,0.8140346344880125,"""No, but I say,"" said Pierre, calming down, ""you are a wonderful fellow! What you have just said is good, very good. Of course you don't know me. We have not met for such a long time... not since we were children. You might think that I... I understand, quite understand. I could not have done it myself, I should not have had the courage, but it's splendid. I am very glad to have made your acquaintance. It's queer,"" he added after a pause, ""that you should have suspected me!"" He began to laugh. ""Well, what of it! I hope we'll get better acquainted,"" and he pressed Boris' hand. ""Do you know, I have not once been in to see the count. He has not sent for me.... I am sorry for him as a man, but what can one do?""",True
1153,chapter_15,0.5407288224239278,0.45927117757607216,"And Boris, having apparently relieved himself of an onerous duty and extricated himself from an awkward situation and placed another in it, became quite pleasant again.",False
1152,chapter_15,0.5966245483244973,0.4033754516755027,"""I am glad I have spoken out fully. Perhaps you did not like it? You must excuse me,"" said he, putting Pierre at ease instead of being put at ease by him, ""but I hope I have not offended you. I always make it a rule to speak out... Well, what answer am I to take? Will you come to dinner at the Rostovs'?""",False
1151,chapter_15,0.4867203086814653,0.5132796913185347,But Boris again interrupted him.,True
1150,chapter_15,0.22160276562165293,0.7783972343783471,"""Well, this is strange! Do you suppose I... who could think?... I know very well...""",True
1149,chapter_15,0.6895994938034917,0.31040050619650833,"For a long time Pierre could not understand, but when he did, he jumped up from the sofa, seized Boris under the elbow in his quick, clumsy way, and, blushing far more than Boris, began to speak with a feeling of mingled shame and vexation.",False
1148,chapter_15,0.8989725400967628,0.10102745990323728,"""But I just wish to say, to avoid misunderstandings, that you are quite mistaken if you reckon me or my mother among such people. We are very poor, but for my own part at any rate, for the very reason that your father is rich, I don't regard myself as a relation of his, and neither I nor my mother would ever ask or take anything from him.""",False
1147,chapter_15,0.3842705563302353,0.6157294436697647,"""So it does,"" thought Pierre.",True
1146,chapter_15,0.5325581978139546,0.46744180218604536,"""And it must seem to you,"" said Boris flushing slightly, but not changing his tone or attitude, ""it must seem to you that everyone is trying to get something out of the rich man?""",False
1144,chapter_15,0.5631085766144542,0.43689142338554576,"""Yes, it is all very horrid,"" interrupted Pierre, ""very horrid.""",False
1141,chapter_15,0.541415734060837,0.45858426593916296,"""We here in Moscow are more occupied with dinner parties and scandal than with politics,"" said he in his quiet ironical tone. ""I know nothing about it and have not thought about it. Moscow is chiefly busy with gossip,"" he continued. ""Just now they are talking about you and your father.""",False
1145,chapter_15,0.5702732915431998,0.4297267084568001,Pierre was still afraid that this officer might inadvertently say something disconcerting to himself.,False
1168,chapter_15,0.7628955903475247,0.23710440965247523,"""Oh, Heaven! How ill he is!"" exclaimed the mother.",False
904,chapter_16,0.569884324441335,0.4301156755586651,"""When would you like them, your excellency?"" asked Dmitri. ""Allow me to inform you... But, don't be uneasy,"" he added, noticing that the count was beginning to breathe heavily and quickly which was always a sign of approaching anger. ""I was forgetting... Do you wish it brought at once?""",False
914,chapter_16,0.5872012986017581,0.412798701398242,"""This is for Boris from me, for his outfit.""",False
913,chapter_16,0.3856386899130485,0.6143613100869515,Anna Mikhaylovna instantly guessed her intention and stooped to be ready to embrace the countess at the appropriate moment.,True
912,chapter_16,0.6705799202166487,0.32942007978335136,"""Annette, for heaven's sake don't refuse me,"" the countess began, with a blush that looked very strange on her thin, dignified, elderly face, and she took the money from under the handkerchief.",False
911,chapter_16,0.9813859311118063,0.018614068888193735,"""Oh, what a terrible state he is in! One would not know him, he is so ill! I was only there a few moments and hardly said a word...""",False
910,chapter_16,0.41983460321999033,0.5801653967800097,"""Well, my dear?"" asked the countess.",True
909,chapter_16,0.5508628235859157,0.44913717641408435,"When Anna Mikhaylovna returned from Count Bezukhov's the money, all in clean notes, was lying ready under a handkerchief on the countess' little table, and Anna Mikhaylovna noticed that something was agitating her.",False
908,chapter_16,0.5779262998384551,0.42207370016154483,"""You, my little countess, are a notorious spendthrift,"" said the count, and having kissed his wife's hand he went back to his study.",False
915,chapter_16,0.43471464348181155,0.5652853565181885,"Anna Mikhaylovna was already embracing her and weeping. The countess wept too. They wept because they were friends, and because they were kindhearted, and because they--friends from childhood--had to think about such a base thing as money, and because their youth was over.... But those tears were pleasant to them both.",True
907,chapter_16,0.60514965503177,0.39485034496823,"""Ah, money, Count, money! How much sorrow it causes in the world,"" said the countess. ""But I am in great need of this sum.""",False
906,chapter_16,0.43592062935418463,0.5640793706458154,"""What a treasure that Dmitri is,"" added the count with a smile when the young man had departed. ""There is never any 'impossible' with him. That's a thing I hate! Everything is possible.""",True
905,chapter_16,0.4262712451541779,0.5737287548458221,"""Yes, yes; just so! Bring it. Give it to the countess.""",True
903,chapter_16,0.40041542056142587,0.5995845794385741,"""Yes, Dmitri, clean ones, please,"" said the countess, sighing deeply.",True
902,chapter_16,0.32261083566760285,0.6773891643323972,"""This is what I want, my dear fellow,"" said the count to the deferential young man who had entered. ""Bring me..."" he reflected a moment, ""yes, bring me seven hundred rubles, yes! But mind, don't bring me such tattered and dirty notes as last time, but nice clean ones for the countess.""",True
900,chapter_16,0.4197246099160531,0.5802753900839469,"""Yes, immediately, immediately! Hey, who's there?"" he called out in a tone only used by persons who are certain that those they call will rush to obey the summons. ""Send Dmitri to me!""",True
901,chapter_16,0.27385141950816483,0.7261485804918352,"Dmitri, a man of good family who had been brought up in the count's house and now managed all his affairs, stepped softly into the room.",True
891,chapter_16,0.6251791801144231,0.37482081988557686,"""Ask the count to come to me.""",False
898,chapter_16,0.6625693170551623,0.3374306829448377,"""Oh, little countess!""... and the count began bustling to get out his pocketbook.",False
897,chapter_16,0.5439847126017472,0.45601528739825287,Her face became sad.,False
896,chapter_16,0.7897494144562205,0.21025058554377957,"""You see, my dear... What's that mess?"" she said, pointing to his waistcoat. ""It's the saute, most likely,"" she added with a smile. ""Well, you see, Count, I want some money.""",False
895,chapter_16,0.4876233868693619,0.5123766131306381,"""What are your commands, little countess?""",True
894,chapter_16,0.7725909558378439,0.22740904416215618,"He sat down by his wife, his elbows on his knees and his hands ruffling his gray hair.",False
893,chapter_16,0.356236642397063,0.643763357602937,"""Well, little countess? What a saute of game au madere we are to have, my dear! I tasted it. The thousand rubles I paid for Taras were not ill-spent. He is worth it!""",True
892,chapter_16,0.5068150190347214,0.49318498096527863,The count came waddling in to see his wife with a rather guilty look as usual.,False
899,chapter_16,0.32885284204965026,0.6711471579503497,"""I want a great deal, Count! I want five hundred rubles,"" and taking out her cambric handkerchief she began wiping her husband's waistcoat.",True
890,chapter_16,0.7649830131069193,0.23501698689308065,"""I am very sorry, ma'am,"" answered the maid.",False
889,chapter_16,0.5468462039677451,0.453153796032255,"The countess was upset by her friend's sorrow and humiliating poverty, and was therefore out of sorts, a state of mind which with her always found expression in calling her maid ""my dear"" and speaking to her with exaggerated politeness.",False
888,chapter_16,0.7777088076947094,0.2222911923052906,"""What is the matter with you, my dear?"" she said crossly to the maid who kept her waiting some minutes. ""Don't you wish to serve me? Then I'll find you another place.""",False
887,chapter_16,0.4563317867481489,0.5436682132518511,"After Anna Mikhaylovna had driven off with her son to visit Count Cyril Vladimirovich Bezukhov, Countess Rostova sat for a long time all alone applying her handkerchief to her eyes. At last she rang.",True
886,chapter_16,0.5066092738849304,0.49339072611506957,CHAPTER XVII,False
629,chapter_17,0.7259728304910491,0.2740271695089509,"Nicholas sat at some distance from Sonya, beside Julie Karagina, to whom he was again talking with the same involuntary smile. Sonya wore a company smile but was evidently tormented by jealousy; now she turned pale, now blushed and strained every nerve to overhear what Nicholas and Julie were saying to one another. The governess kept looking round uneasily as if preparing to resent any slight that might be put upon the children. The German tutor was trying to remember all the dishes, wines, and kinds of dessert, in order to send a full description of the dinner to his people in Germany; and he felt greatly offended when the butler with a bottle wrapped in a napkin passed him by. He frowned, trying to appear as if he did not want any of that wine, but was mortified because no one would understand that it was not to quench his thirst or from greediness that he wanted it, but simply from a conscientious desire for knowledge.",False
628,chapter_17,0.484477637516901,0.515522362483099,"The count went in first with Marya Dmitrievna, the countess followed on the arm of a colonel of hussars, a man of importance to them because Nicholas was to go with him to the regiment; then came Anna Mikhaylovna with Shinshin. Berg gave his arm to Vera. The smiling Julie Karagina went in with Nicholas. After them other couples followed, filling the whole dining hall, and last of all the children, tutors, and governesses followed singly. The footmen began moving about, chairs scraped, the band struck up in the gallery, and the guests settled down in their places. Then the strains of the count's household band were replaced by the clatter of knives and forks, the voices of visitors, and the soft steps of the footmen. At one end of the table sat the countess with Marya Dmitrievna on her right and Anna Mikhaylovna on her left, the other lady visitors were farther down. At the other end sat the count, with the hussar colonel on his left and Shinshin and the other male visitors on his right. Midway down the long table on one side sat the grownup young people: Vera beside Berg, and Pierre beside Boris; and on the other side, the children, tutors, and governesses. From behind the crystal decanters and fruit vases the count kept glancing at his wife and her tall cap with its light-blue ribbons, and busily filled his neighbors' glasses, not neglecting his own. The countess in turn, without omitting her duties as hostess, threw significant glances from behind the pineapples at her husband whose face and bald head seemed by their redness to contrast more than usual with his gray hair. At the ladies' end an even chatter of voices was heard all the time, at the men's end the voices sounded louder and louder, especially that of the colonel of hussars who, growing more and more flushed, ate and drank so much that the count held him up as a pattern to the other guests. Berg with tender smiles was saying to Vera that love is not an earthly but a heavenly feeling. Boris was telling his new friend Pierre who the guests were and exchanging glances with Natasha, who was sitting opposite. Pierre spoke little but examined the new faces, and ate a great deal. Of the two soups he chose turtle with savory patties and went on to the game without omitting a single dish or one of the wines. These latter the butler thrust mysteriously forward, wrapped in a napkin, from behind the next man's shoulders and whispered: ""Dry Madeira""... ""Hungarian""... or ""Rhine wine"" as the case might be. Of the four crystal glasses engraved with the count's monogram that stood before his plate, Pierre held out one at random and drank with enjoyment, gazing with ever-increasing amiability at the other guests. Natasha, who sat opposite, was looking at Boris as girls of thirteen look at the boy they are in love with and have just kissed for the first time. Sometimes that same look fell on Pierre, and that funny lively little girl's look made him inclined to laugh without knowing why.",True
606,chapter_17,0.5761797453936768,0.42382025460632317,"Berg smiled joyously. The count, by his guests, went into the drawing room.",False
627,chapter_17,0.4394755882528416,0.5605244117471584,"""Well, I suppose it is time we were at table?"" said Marya Dmitrievna.",True
607,chapter_17,0.6320892981412611,0.36791070185873886,"It was just the moment before a big dinner when the assembled guests, expecting the summons to zakuska,* avoid engaging in any long conversation but think it necessary to move about and talk, in order to show that they are not at all impatient for their food. The host and hostess look toward the door, and now and then glance at one another, and the visitors try to guess from these glances who, or what, they are waiting for--some important relation who has not yet arrived, or a dish that is not yet ready.",False
625,chapter_17,0.6320768011899913,0.3679231988100086,"""A fine lad! My word! A fine lad!... His father lies on his deathbed and he amuses himself setting a policeman astride a bear! For shame, sir, for shame! It would be better if you went to the war.""",False
592,chapter_17,0.5066092738849304,0.49339072611506957,CHAPTER XVIII,False
593,chapter_17,0.37468640424240407,0.6253135957575959,"Countess Rostova, with her daughters and a large number of guests, was already seated in the drawing room. The count took the gentlemen into his study and showed them his choice collection of Turkish pipes. From time to time he went out to ask: ""Hasn't she come yet?"" They were expecting Marya Dmitrievna Akhrosimova, known in society as le terrible dragon, a lady distinguished not for wealth or rank, but for common sense and frank plainness of speech. Marya Dmitrievna was known to the Imperial family as well as to all Moscow and Petersburg, and both cities wondered at her, laughed privately at her rudenesses, and told good stories about her, while none the less all without exception respected and feared her.",True
594,chapter_17,0.6278949611066877,0.37210503889331226,"In the count's room, which was full of tobacco smoke, they talked of war that had been announced in a manifesto, and about the recruiting. None of them had yet seen the manifesto, but they all knew it had appeared. The count sat on the sofa between two guests who were smoking and talking. He neither smoked nor talked, but bending his head first to one side and then to the other watched the smokers with evident pleasure and listened to the conversation of his two neighbors, whom he egged on against each other.",False
595,chapter_17,0.4839586768773425,0.5160413231226575,"One of them was a sallow, clean-shaven civilian with a thin and wrinkled face, already growing old, though he was dressed like a most fashionable young man. He sat with his legs up on the sofa as if quite at home and, having stuck an amber mouthpiece far into his mouth, was inhaling the smoke spasmodically and screwing up his eyes. This was an old bachelor, Shinshin, a cousin of the countess', a man with ""a sharp tongue"" as they said in Moscow society. He seemed to be condescending to his companion. The latter, a fresh, rosy officer of the Guards, irreproachably washed, brushed, and buttoned, held his pipe in the middle of his mouth and with red lips gently inhaled the smoke, letting it escape from his handsome mouth in rings. This was Lieutenant Berg, an officer in the Semenov regiment with whom Boris was to travel to join the army, and about whom Natasha had, teased her elder sister Vera, speaking of Berg as her ""intended."" The count sat between them and listened attentively. His favorite occupation when not playing boston, a card game he was very fond of, was that of listener, especially when he succeeded in setting two loquacious talkers at one another.",True
596,chapter_17,0.4883580763179477,0.5116419236820523,"""Well, then, old chap, mon tres honorable Alphonse Karlovich,"" said Shinshin, laughing ironically and mixing the most ordinary Russian expressions with the choicest French phrases--which was a peculiarity of his speech. ""Vous comptez vous faire des rentes sur l'etat;* you want to make something out of your company?""",True
597,chapter_17,0.5122074977366275,0.4877925022633725,You expect to make an income out of the government.,False
608,chapter_17,0.5120208118040936,0.4879791881959064,Hors d'oeuvres.,False
598,chapter_17,0.6175042611273406,0.3824957388726594,"""No, Peter Nikolaevich; I only want to show that in the cavalry the advantages are far less than in the infantry. Just consider my own position now, Peter Nikolaevich...""",False
600,chapter_17,0.47416153571233355,0.5258384642876665,"""Consider my position, Peter Nikolaevich. Were I in the cavalry I should get not more than two hundred rubles every four months, even with the rank of lieutenant; but as it is I receive two hundred and thirty,"" said he, looking at Shinshin and the count with a joyful, pleasant smile, as if it were obvious to him that his success must always be the chief desire of everyone else.",True
601,chapter_17,0.6080359218324239,0.39196407816757606,"""Besides that, Peter Nikolaevich, by exchanging into the Guards I shall be in a more prominent position,"" continued Berg, ""and vacancies occur much more frequently in the Foot Guards. Then just think what can be done with two hundred and thirty rubles! I even manage to put a little aside and to send something to my father,"" he went on, emitting a smoke ring.",False
602,chapter_17,0.3323616175388283,0.6676383824611717,"""La balance y est...* A German knows how to skin a flint, as the proverb says,"" remarked Shinshin, moving his pipe to the other side of his mouth and winking at the count.",True
603,chapter_17,0.49120384352689606,0.5087961564731039,So that squares matters.,True
604,chapter_17,0.48728711710787553,0.5127128828921245,"The count burst out laughing. The other guests seeing that Shinshin was talking came up to listen. Berg, oblivious of irony or indifference, continued to explain how by exchanging into the Guards he had already gained a step on his old comrades of the Cadet Corps; how in wartime the company commander might get killed and he, as senior in the company, might easily succeed to the post; how popular he was with everyone in the regiment, and how satisfied his father was with him. Berg evidently enjoyed narrating all this, and did not seem to suspect that others, too, might have their own interests. But all he said was so prettily sedate, and the naivete of his youthful egotism was so obvious, that he disarmed his hearers.",True
626,chapter_17,0.768467076239137,0.23153292376086296,"She turned away and gave her hand to the count, who could hardly keep from laughing.",False
599,chapter_17,0.48210825796419066,0.5178917420358093,"Berg always spoke quietly, politely, and with great precision. His conversation always related entirely to himself; he would remain calm and silent when the talk related to any topic that had no direct bearing on himself. He could remain silent for hours without being at all put out of countenance himself or making others uncomfortable, but as soon as the conversation concerned himself he would begin to talk circumstantially and with evident satisfaction.",True
609,chapter_17,0.6156937447027453,0.38430625529725465,"Pierre had come just at dinnertime and was sitting awkwardly in the middle of the drawing room on the first chair he had come across, blocking the way for everyone. The countess tried to make him talk, but he went on naively looking around through his spectacles as if in search of somebody and answered all her questions in monosyllables. He was in the way and was the only one who did not notice the fact. Most of the guests, knowing of the affair with the bear, looked with curiosity at this big, stout, quiet man, wondering how such a clumsy, modest fellow could have played such a prank on a policeman.",False
605,chapter_17,0.3891455425969772,0.6108544574030228,"""Well, my boy, you'll get along wherever you go--foot or horse--that I'll warrant,"" said Shinshin, patting him on the shoulder and taking his feet off the sofa.",True
611,chapter_17,0.5492080396039343,0.4507919603960657,"""Oui, madame,"" replied he, looking around him.",False
610,chapter_17,0.43321685631973306,0.5667831436802669,"""You have only lately arrived?"" the countess asked him.",True
623,chapter_17,0.3643476932642513,0.6356523067357487,"""Eh, eh, friend! Come here a bit,"" said she, assuming a soft high tone of voice. ""Come here, my friend..."" and she ominously tucked up her sleeves still higher. Pierre approached, looking at her in a childlike way through his spectacles.",True
622,chapter_17,0.41710452691093347,0.5828954730890665,"She took a pair of pear-shaped ruby earrings from her huge reticule and, having given them to the rosy Natasha, who beamed with the pleasure of her saint's-day fete, turned away at once and addressed herself to Pierre.",True
621,chapter_17,0.42096325075404706,0.5790367492459529,"""Well,"" said she, ""how's my Cossack?"" (Marya Dmitrievna always called Natasha a Cossack) and she stroked the child's arm as she came up fearless and gay to kiss her hand. ""I know she's a scamp of a girl, but I like her.""",True
620,chapter_17,0.6048498361014273,0.3951501638985727,"""Health and happiness to her whose name day we are keeping and to her children,"" she said, in her loud, full-toned voice which drowned all others. ""Well, you old sinner,"" she went on, turning to the count who was kissing her hand, ""you're feeling dull in Moscow, I daresay? Nowhere to hunt with your dogs? But what is to be done, old man? Just see how these nestlings are growing up,"" and she pointed to the girls. ""You must look for husbands for them whether you like it or not....""",False
619,chapter_17,0.5416621790737228,0.45833782092627723,"All the unmarried ladies and even the married ones except the very oldest rose. Marya Dmitrievna paused at the door. Tall and stout, holding high her fifty-year-old head with its gray curls, she stood surveying the guests, and leisurely arranged her wide sleeves as if rolling them up. Marya Dmitrievna always spoke in Russian.",False
618,chapter_17,0.39781972582220193,0.6021802741777981,"""Herself,"" came the answer in a rough voice, and Marya Dmitrievna entered the room.",True
624,chapter_17,0.461933519573714,0.538066480426286,"""Come nearer, come nearer, friend! I used to be the only one to tell your father the truth when he was in favor, and in your case it's my evident duty."" She paused. All were silent, expectant of what was to follow, for this was dearly only a prelude.",True
616,chapter_17,0.37269357238156287,0.6273064276184371,"The countess exchanged glances with Anna Mikhaylovna. The latter understood that she was being asked to entertain this young man, and sitting down beside him she began to speak about his father; but he answered her, as he had the countess, only in monosyllables. The other guests were all conversing with one another. ""The Razumovskis... It was charming... You are very kind... Countess Apraksina..."" was heard on all sides. The countess rose and went into the ballroom.",True
615,chapter_17,0.805817579967211,0.194182420032789,"""Very interesting.""",False
614,chapter_17,0.6974926444785449,0.30250735552145513,"""You have been in Paris recently, I believe? I suppose it's very interesting.""",False
613,chapter_17,0.4741191246486216,0.5258808753513784,"""Non, madame."" He smiled quite inappropriately.",True
612,chapter_17,0.23203790272839342,0.7679620972716066,"""You have not yet seen my husband?""",True
617,chapter_17,0.401794995600237,0.598205004399763,"""Marya Dmitrievna?"" came her voice from there.",True
213,chapter_18,0.44601330676821727,0.5539866932317827,Pierre listened to the colonel's speech and nodded approvingly.,True
214,chapter_18,0.4518812717834383,0.5481187282165617,"""That's fine,"" said he.",True
215,chapter_18,0.35474555938303953,0.6452544406169605,"""The young man's a real hussar!"" shouted the colonel, again thumping the table.",True
