index,Chapter,Neg,Pos,line,Positive
723,chapter_27,0.6442689525368155,0.3557310474631845,He embraced her. She screamed and fell unconscious on his shoulder.,False
724,chapter_27,0.41282345784412655,0.5871765421558734,"He cautiously released the shoulder she leaned on, looked into her face, and carefully placed her in an easy chair.",True
725,chapter_27,0.49698427993601146,0.5030157200639885,"""Adieu, Mary,"" said he gently to his sister, taking her by the hand and kissing her, and then he left the room with rapid steps.",True
726,chapter_27,0.25983586455839425,0.7401641354416058,"The little princess lay in the armchair, Mademoiselle Bourienne chafing her temples. Princess Mary, supporting her sister-in-law, still looked with her beautiful eyes full of tears at the door through which Prince Andrew had gone and made the sign of the cross in his direction. From the study, like pistol shots, came the frequent sound of the old man angrily blowing his nose. Hardly had Prince Andrew gone when the study door opened quickly and the stern figure of the old man in the white dressing gown looked out.",True
727,chapter_27,0.5155077199446014,0.4844922800553986,"""Gone? That's all right!"" said he; and looking angrily at the unconscious little princess, he shook his head reprovingly and slammed the door.",False
706,chapter_27,0.5090603946988084,0.4909396053011916,Kutuzov.,False
705,chapter_27,0.718695756606264,0.2813042433937361,"""Listen!"" said he; ""don't worry about your wife: what can be done shall be. Now listen! Give this letter to Michael Ilarionovich.* I have written that he should make use of you in proper places and not keep you long as an adjutant: a bad position! Tell him I remember and like him. Write and tell me how he receives you. If he is all right--serve him. Nicholas Bolkonski's son need not serve under anyone if he is in disfavor. Now come here.""",False
714,chapter_27,0.6256338128443957,0.3743661871556043,"""I also wanted to ask you,"" continued Prince Andrew, ""if I'm killed and if I have a son, do not let him be taken away from you- as I said yesterday... let him grow up with you.... Please.""",False
703,chapter_27,0.4945251864176662,0.5054748135823338,"""What's to be done? She's pretty! I will do everything. Make your mind easy,"" said he in abrupt sentences while sealing his letter.",True
681,chapter_27,0.3449580218740502,0.6550419781259498,"This very sentence about Countess Zubova and this same laugh Prince Andrew had already heard from his wife in the presence of others some five times. He entered the room softly. The little princess, plump and rosy, was sitting in an easy chair with her work in her hands, talking incessantly, repeating Petersburg reminiscences and even phrases. Prince Andrew came up, stroked her hair, and asked if she felt rested after their journey. She answered him and continued her chatter.",True
704,chapter_27,0.3031530718305503,0.6968469281694497,Andrew did not speak; he was both pleased and displeased that his father understood him. The old man got up and gave the letter to his son.,True
684,chapter_27,0.8147382000235923,0.18526179997640765,"""Going?"" And he went on writing.",False
685,chapter_27,0.29287250323665415,0.7071274967633459,"""I've come to say good-by.""",True
686,chapter_27,0.1950180340907024,0.8049819659092976,"""Kiss me here,"" and he touched his cheek: ""Thanks, thanks!""",True
687,chapter_27,0.29276436935922,0.70723563064078,"""What do you thank me for?""",True
688,chapter_27,0.4716219488078872,0.5283780511921128,"""For not dilly-dallying and not hanging to a woman's apron strings. The Service before everything. Thanks, thanks!"" And he went on writing, so that his quill spluttered and squeaked. ""If you have anything to say, say it. These two things can be done together,"" he added.",True
689,chapter_27,0.7408439823124155,0.2591560176875844,"""About my wife... I am ashamed as it is to leave her on your hands...""",False
690,chapter_27,0.8243585243506055,0.1756414756493945,"""Why talk nonsense? Say what you want.""",False
691,chapter_27,0.5453645531014988,0.4546354468985012,"""When her confinement is due, send to Moscow for an accoucheur.... Let him be here....""",False
682,chapter_27,0.18011797373298266,0.8198820262670173,"The coach with six horses was waiting at the porch. It was an autumn night, so dark that the coachman could not see the carriage pole. Servants with lanterns were bustling about in the porch. The immense house was brilliant with lights shining through its lofty windows. The domestic serfs were crowding in the hall, waiting to bid good-by to the young prince. The members of the household were all gathered in the reception hall: Michael Ivanovich, Mademoiselle Bourienne, Princess Mary, and the little princess. Prince Andrew had been called to his father's study as the latter wished to say good-by to him alone. All were waiting for them to come out.",True
693,chapter_27,0.282746328193463,0.717253671806537,"""I know that no one can help if nature does not do her work,"" said Prince Andrew, evidently confused. ""I know that out of a million cases only one goes wrong, but it is her fancy and mine. They have been telling her things. She has had a dream and is frightened.""",True
692,chapter_27,0.3943962552740794,0.6056037447259206,"The old prince stopped writing and, as if not understanding, fixed his stern eyes on his son.",True
701,chapter_27,0.5089517680727459,0.4910482319272541,"He seized his son by the hand with small bony fingers, shook it, looked straight into his son's face with keen eyes which seemed to see through him, and again laughed his frigid laugh.",False
700,chapter_27,0.42439552062860453,0.5756044793713955,"""No, it can't be helped, lad,"" said the prince. ""They're all like that; one can't unmarry. Don't be afraid; I won't tell anyone, but you know it yourself.""",True
699,chapter_27,0.2578079688637621,0.7421920311362379,"""I don't understand!"" said Prince Andrew.",True
702,chapter_27,0.4945934834789676,0.5054065165210324,"The son sighed, thus admitting that his father had understood him. The old man continued to fold and seal his letter, snatching up and throwing down the wax, the seal, and the paper, with his accustomed rapidity.",True
697,chapter_27,0.9602860783567397,0.039713921643260264,"""What is bad, Father?""",False
696,chapter_27,0.8887596177208124,0.11124038227918769,"""It's a bad business, eh?""",False
695,chapter_27,0.5350060836655568,0.4649939163344432,He signed with a flourish and suddenly turning to his son began to laugh.,False
694,chapter_27,0.5108996305856324,0.48910036941436763,"""Hm... Hm..."" muttered the old prince to himself, finishing what he was writing. ""I'll do it.""",False
698,chapter_27,0.5113866147463944,0.48861338525360565,"""The wife!"" said the old prince, briefly and significantly.",False
489,chapter_3,0.5481806993943548,0.4518193006056452,"""I knew you would be here,"" replied Pierre. ""I will come to supper with you. May I?"" he added in a low voice so as not to disturb the vicomte who was continuing his story.",False
495,chapter_3,0.3731256079795666,0.6268743920204334,"In passing Prince Vasili seized Pierre's hand and said to Anna Pavlovna: ""Educate this bear for me! He has been staying with me a whole month and this is the first time I have seen him in society. Nothing is so necessary for a young man as the society of clever women.""",True
494,chapter_3,0.581758905070866,0.418241094929134,"""Very,"" said Pierre.",False
493,chapter_3,0.2101245885610452,0.7898754114389548,"""Very lovely,"" said Prince Andrew.",True
492,chapter_3,0.2676864036925577,0.7323135963074423,"His daughter, Princess Helene, passed between the chairs, lightly holding up the folds of her dress, and the smile shone still more radiantly on her beautiful face. Pierre gazed at her with rapturous, almost frightened, eyes as she passed him.",True
491,chapter_3,0.6579531053538193,0.34204689464618065,"""You must excuse me, dear Vicomte,"" said Prince Vasili to the Frenchman, holding him down by the sleeve in a friendly way to prevent his rising. ""This unfortunate fete at the ambassador's deprives me of a pleasure, and obliges me to interrupt you. I am very sorry to leave your enchanting party,"" said he, turning to Anna Pavlovna.",False
490,chapter_3,0.40099779979300054,0.5990022002069995,"""No, impossible!"" said Prince Andrew, laughing and pressing Pierre's hand to show that there was no need to ask the question. He wished to say something more, but at that moment Prince Vasili and his daughter got up to go and the two young men rose to let them pass.",True
488,chapter_3,0.0825703913859942,0.9174296086140058,"""There now!... So you, too, are in the great world?"" said he to Pierre.",True
483,chapter_3,0.5336928164083061,0.4663071835916939,"""And Lise, your wife?""",False
486,chapter_3,0.42356477248443913,0.5764352275155609,"""Andre,"" said his wife, addressing her husband in the same coquettish manner in which she spoke to other men, ""the vicomte has been telling us such a tale about Mademoiselle George and Buonaparte!""",True
496,chapter_3,0.4310658756327955,0.5689341243672045,Anna Pavlovna smiled and promised to take Pierre in hand. She knew his father to be a connection of Prince Vasili's. The elderly lady who had been sitting with the old aunt rose hurriedly and overtook Prince Vasili in the anteroom. All the affectation of interest she had assumed had left her kindly and tearworn face and it now expressed only anxiety and fear.,True
485,chapter_3,0.4869852473809516,0.5130147526190484,"""Are you not ashamed to deprive us of your charming wife?""",True
484,chapter_3,0.40038269235342827,0.5996173076465717,"""She will go to the country.""",True
482,chapter_3,0.5543772705118153,0.44562272948818477,"""General Kutuzov,"" said Bolkonski, speaking French and stressing the last syllable of the general's name like a Frenchman, ""has been pleased to take me as an aide-de-camp....""",False
481,chapter_3,0.2434647741967867,0.7565352258032133,"""You are off to the war, Prince?"" said Anna Pavlovna.",True
480,chapter_3,0.5765953192875009,0.42340468071249915,"Just then another visitor entered the drawing room: Prince Andrew Bolkonski, the little princess' husband. He was a very handsome young man, of medium height, with firm, clearcut features. Everything about him, from his weary, bored expression to his quiet, measured step, offered a most striking contrast to his quiet, little wife. It was evident that he not only knew everyone in the drawing room, but had found them to be so tiresome that it wearied him to look at or listen to them. And among all these faces that he found so tedious, none seemed to bore him so much as that of his pretty wife. He turned away from her with a grimace that distorted his handsome face, kissed Anna Pavlovna's hand, and screwing up his eyes scanned the whole company.",False
479,chapter_3,0.47441685333750805,0.525583146662492,CHAPTER IV,True
487,chapter_3,0.21240592846787487,0.7875940715321251,"Prince Andrew screwed up his eyes and turned away. Pierre, who from the moment Prince Andrew entered the room had watched him with glad, affectionate eyes, now came up and took his arm. Before he looked round Prince Andrew frowned again, expressing his annoyance with whoever was touching his arm, but when he saw Pierre's beaming face he gave him an unexpectedly kind and pleasant smile.",True
497,chapter_3,0.7438679141080959,0.256132085891904,"""How about my son Boris, Prince?"" said she, hurrying after him into the anteroom. ""I can't remain any longer in Petersburg. Tell me what news I may take back to my poor boy.""",False
511,chapter_3,0.36084427471974734,0.6391557252802527,"""Papa,"" said his beautiful daughter in the same tone as before, ""we shall be late.""",True
499,chapter_3,0.7988863476010439,0.201113652398956,"""What would it cost you to say a word to the Emperor, and then he would be transferred to the Guards at once?"" said she.",False
498,chapter_3,0.5145119724841722,0.48548802751582776,"Although Prince Vasili listened reluctantly and not very politely to the elderly lady, even betraying some impatience, she gave him an ingratiating and appealing smile, and took his hand that he might not go away.",False
516,chapter_3,0.4944063423171021,0.5055936576828979,"Apparently she had forgotten her age and by force of habit employed all the old feminine arts. But as soon as the prince had gone her face resumed its former cold, artificial expression. She returned to the group where the vicomte was still talking, and again pretended to listen, while waiting till it would be time to leave. Her task was accomplished.",True
515,chapter_3,0.4946621441057386,0.5053378558942614,"""Do promise, do promise, Vasili!"" cried Anna Mikhaylovna as he went, with the smile of a coquettish girl, which at one time probably came naturally to her, but was now very ill-suited to her careworn face.",True
513,chapter_3,0.6200854887109615,0.3799145112890385,"""Then tomorrow you will speak to the Emperor?""",False
512,chapter_3,0.1753645590359464,0.8246354409640536,"""Well, au revoir! Good-by! You hear her?""",True
510,chapter_3,0.7650706985432916,0.2349293014567084,"""No, but do promise! I won't let you go! My dear benefactor...""",False
509,chapter_3,0.4642219649524364,0.5357780350475636,"""No, I won't promise that. You don't know how Kutuzov is pestered since his appointment as Commander in Chief. He told me himself that all the Moscow ladies have conspired to give him all their sons as adjutants.""",True
508,chapter_3,0.35544705187163084,0.6445529481283692,Prince Vasili smiled.,True
514,chapter_3,0.606772935415932,0.393227064584068,"""Certainly; but about Kutuzov, I don't promise.""",False
506,chapter_3,0.6239502659737843,0.37604973402621567,"""My dear benefactor! This is what I expected from you--I knew your kindness!"" He turned to go.",False
505,chapter_3,0.48210142125550437,0.5178985787444956,"""My dear Anna Mikhaylovna,"" said he with his usual familiarity and weariness of tone, ""it is almost impossible for me to do what you ask; but to prove my devotion to you and how I respect your father's memory, I will do the impossible--your son shall be transferred to the Guards. Here is my hand on it. Are you satisfied?""",True
504,chapter_3,0.37161113855793404,0.628388861442066,"Influence in society, however, is a capital which has to be economized if it is to last. Prince Vasili knew this, and having once realized that if he asked on behalf of all who begged of him, he would soon be unable to ask for himself, he became chary of using his influence. But in Princess Drubetskaya's case he felt, after her second appeal, something like qualms of conscience. She had reminded him of what was quite true; he had been indebted to her father for the first steps in his career. Moreover, he could see by her manners that she was one of those women--mostly mothers--who, having once made up their minds, will not rest until they have gained their end, and are prepared if necessary to go on insisting day after day and hour after hour, and even to make scenes. This last consideration moved him.",True
503,chapter_3,0.4325240774621716,0.5674759225378284,"""Papa, we shall be late,"" said Princess Helene, turning her beautiful head and looking over her classically molded shoulder as she stood waiting by the door.",True
502,chapter_3,0.32613445782421024,0.6738655421757898,"""Listen to me, Prince,"" said she. ""I have never yet asked you for anything and I never will again, nor have I ever reminded you of my father's friendship for you; but now I entreat you for God's sake to do this for my son--and I shall always regard you as a benefactor,"" she added hurriedly. ""No, don't be angry, but promise! I have asked Golitsyn and he has refused. Be the kindhearted man you always were,"" she said, trying to smile though tears were in her eyes.",True
501,chapter_3,0.38352006797375315,0.6164799320262468,"The elderly lady was a Princess Drubetskaya, belonging to one of the best families in Russia, but she was poor, and having long been out of society had lost her former influential connections. She had now come to Petersburg to procure an appointment in the Guards for her only son. It was, in fact, solely to meet Prince Vasili that she had obtained an invitation to Anna Pavlovna's reception and had sat listening to the vicomte's story. Prince Vasili's words frightened her, an embittered look clouded her once handsome face, but only for a moment; then she smiled again and dutched Prince Vasili's arm more tightly.",True
507,chapter_3,0.44137226744305647,0.5586277325569435,"""Wait--just a word! When he has been transferred to the Guards..."" she faltered. ""You are on good terms with Michael Ilarionovich Kutuzov... recommend Boris to him as adjutant! Then I shall be at rest, and then...""",True
500,chapter_3,0.37053404938455514,0.6294659506154449,"""Believe me, Princess, I am ready to do all I can,"" answered Prince Vasili, ""but it is difficult for me to ask the Emperor. I should advise you to appeal to Rumyantsev through Prince Golitsyn. That would be the best way.""",True
1032,chapter_4,0.3115401599443879,0.6884598400556121,"""Bonaparte has said so,"" remarked Prince Andrew with a sarcastic smile.",True
1033,chapter_4,0.49083397300251996,0.50916602699748,"It was evident that he did not like the vicomte and was aiming his remarks at him, though without looking at him.",True
1034,chapter_4,0.365007133155128,0.634992866844872,"""'I showed them the path to glory, but they did not follow it,'"" Prince Andrew continued after a short silence, again quoting Napoleon's words. ""'I opened my antechambers and they crowded in.' I do not know how far he was justified in saying so.""",True
1036,chapter_4,0.4030113841194487,0.5969886158805513,"Before Anna Pavlovna and the others had time to smile their appreciation of the vicomte's epigram, Pierre again broke into the conversation, and though Anna Pavlovna felt sure he would say something inappropriate, she was unable to stop him.",True
1040,chapter_4,0.8429437890301756,0.1570562109698244,"""Oh! Oh!"" exclaimed several voices.",False
1038,chapter_4,0.4703724331552086,0.5296275668447914,"""Dieu! Mon Dieu!"" muttered Anna Pavlovna in a terrified whisper.",True
1039,chapter_4,0.3269858809438031,0.6730141190561969,"""What, Monsieur Pierre... Do you consider that assassination shows greatness of soul?"" said the little princess, smiling and drawing her work nearer to her.",True
1041,chapter_4,0.46229405842418436,0.5377059415758156,"""Capital!"" said Prince Hippolyte in English, and began slapping his knee with the palm of his hand.",True
1042,chapter_4,0.6138247064479654,0.38617529355203467,The vicomte merely shrugged his shoulders. Pierre looked solemnly at his audience over his spectacles and continued.,False
1031,chapter_4,0.3499275815745492,0.6500724184254508,"""It is the Buonapartists who say that,"" replied the vicomte without looking at Pierre. ""At the present time it is difficult to know the real state of French public opinion.""",True
1037,chapter_4,0.5650647916551635,0.43493520834483645,"""The execution of the Duc d'Enghien,"" declared Monsieur Pierre, ""was a political necessity, and it seems to me that Napoleon showed greatness of soul by not fearing to take on himself the whole responsibility of that deed.""",False
1030,chapter_4,0.4015347055955212,0.5984652944044788,"""From what I have heard,"" said Pierre, blushing and breaking into the conversation, ""almost all the aristocracy has already gone over to Bonaparte's side.""",True
1022,chapter_4,0.47747944767090444,0.5225205523290956,"And sighing disdainfully, he again changed his position.",True
1028,chapter_4,0.490692267344669,0.509307732655331,"""The Emperor Alexander,"" said she, with the melancholy which always accompanied any reference of hers to the Imperial family, ""has declared that he will leave it to the French people themselves to choose their own form of government; and I believe that once free from the usurper, the whole nation will certainly throw itself into the arms of its rightful king,"" she concluded, trying to be amiable to the royalist emigrant.",True
1027,chapter_4,0.40941082862862777,0.5905891713713722,"He shrugged his shoulders and spread out his hands. Pierre wished to make a remark, for the conversation interested him, but Anna Pavlovna, who had him under observation, interrupted:",True
1026,chapter_4,0.2884965909010718,0.7115034090989282,"""If Buonaparte remains on the throne of France a year longer,"" the vicomte continued, with the air of a man who, in a matter with which he is better acquainted than anyone else, does not listen to others but follows the current of his own thoughts, ""things will have gone too far. By intrigues, violence, exile, and executions, French society--I mean good French society--will have been forever destroyed, and then...""",True
1025,chapter_4,0.349705871278303,0.650294128721697,"The princess listened, smiling.",True
1024,chapter_4,0.5407405029699783,0.45925949703002167,"""Baton de gueules, engrele de gueules d' azur--maison Conde,"" said he.",False
1023,chapter_4,0.49627128798876774,0.5037287120112323,"Prince Hippolyte, who had been gazing at the vicomte for some time through his lorgnette, suddenly turned completely round toward the little princess, and having asked for a needle began tracing the Conde coat of arms on the table. He explained this to her with as much gravity as if she had asked him to do it.",True
1043,chapter_4,0.4704328342256173,0.5295671657743827,"""I say so,"" he continued desperately, ""because the Bourbons fled from the Revolution leaving the people to anarchy, and Napoleon alone understood the Revolution and quelled it, and so for the general good, he could not stop short for the sake of one man's life.""",True
1021,chapter_4,0.6333425837546645,0.3666574162453355,"""The sovereigns? I do not speak of Russia,"" said the vicomte, polite but hopeless: ""The sovereigns, madame... What have they done for Louis XVII, for the Queen, or for Madame Elizabeth? Nothing!"" and he became more animated. ""And believe me, they are reaping the reward of their betrayal of the Bourbon cause. The sovereigns! Why, they are sending ambassadors to compliment the usurper.""",False
1020,chapter_4,0.4419168733363611,0.5580831266636389,"""I hope this will prove the last drop that will make the glass run over,"" Anna Pavlovna continued. ""The sovereigns will not be able to endure this man who is a menace to everything.""",True
1019,chapter_4,0.6276401996798748,0.37235980032012517,"God has given it to me, let him who touches it beware!",False
1018,chapter_4,0.47117345591096016,0.5288265440890398,"""'Dieu me la donne, gare a qui la touche!'* They say he was very fine when he said that,"" he remarked, repeating the words in Italian: ""'Dio mi l'ha dato. Guai a chi la tocchi!'""",True
1017,chapter_4,0.3418813987909075,0.6581186012090925,Prince Andrew looked Anna Pavlovna straight in the face with a sarcastic smile.,True
1029,chapter_4,0.33224615412131553,0.6677538458786845,"""That is doubtful,"" said Prince Andrew. ""Monsieur le Vicomte quite rightly supposes that matters have already gone too far. I think it will be difficult to return to the old regime.""",True
1044,chapter_4,0.40960390250788514,0.5903960974921149,"""Won't you come over to the other table?"" suggested Anna Pavlovna.",True
1053,chapter_4,0.3424496357816631,0.6575503642183369,"""Those were extremes, no doubt, but they are not what is most important. What is important are the rights of man, emancipation from prejudices, and equality of citizenship, and all these ideas Napoleon has retained in full force.""",True
1046,chapter_4,0.19965805328681718,0.8003419467131828,"""No,"" cried he, becoming more and more eager, ""Napoleon is great because he rose superior to the Revolution, suppressed its abuses, preserved all that was good in it--equality of citizenship and freedom of speech and of the press--and only for that reason did he obtain power.""",True
1073,chapter_4,0.25513773614966406,0.7448622638503359,"And so the anecdote ended. Though it was unintelligible why he had told it, or why it had to be told in Russian, still Anna Pavlovna and the others appreciated Prince Hippolyte's social tact in so agreeably ending Pierre's unpleasant and unamiable outburst. After the anecdote the conversation broke up into insignificant small talk about the last and next balls, about theatricals, and who would meet whom, and when and where.",True
1072,chapter_4,0.4376155506671292,0.5623844493328708,"""She went. Suddenly there was a great wind. The girl lost her hat and her long hair came down...."" Here he could contain himself no longer and went on, between gasps of laughter: ""And the whole world knew....""",True
1071,chapter_4,0.23562802420572693,0.7643719757942731,"Here Prince Hippolyte spluttered and burst out laughing long before his audience, which produced an effect unfavorable to the narrator. Several persons, among them the elderly lady and Anna Pavlovna, did however smile.",True
1070,chapter_4,0.8053043553541541,0.19469564464584593,"""She said... Oh yes! She said, 'Girl,' to the maid, 'put on a livery, get up behind the carriage, and come with me while I make some calls.'""",False
1069,chapter_4,0.3703367112173579,0.6296632887826421,"Here Prince Hippolyte paused, evidently collecting his ideas with difficulty.",True
1068,chapter_4,0.5280521369048347,0.47194786309516534,"""There is in Moscow a lady, une dame, and she is very stingy. She must have two footmen behind her carriage, and very big ones. That was her taste. And she had a lady's maid, also big. She said...""",False
